19:55:15.472311 STP 802.1d, Config, Flags [none], bridge-id 8000.52:54:00:aa:5b:c8.8001, length 35
19:55:17.457663 STP 802.1d, Config, Flags [none], bridge-id 8000.52:54:00:aa:5b:c8.8001, length 35
19:55:19.443661 STP 802.1d, Config, Flags [none], bridge-id 8000.52:54:00:aa:5b:c8.8001, length 35
19:55:21.491185 STP 802.1d, Config, Flags [none], bridge-id 8000.52:54:00:aa:5b:c8.8001, length 35
19:55:23.476043 STP 802.1d, Config, Flags [none], bridge-id 8000.52:54:00:aa:5b:c8.8001, length 35
19:55:23.909979 IP lucas-HP-Pavilion.43516 > debian-target.http: Flags [S], seq 1727652905, win 64240, options [mss 1460,sackOK,TS val 1913351594 ecr 0,nop,wscale 7], length 0
19:55:23.910083 IP debian-target.http > lucas-HP-Pavilion.43516: Flags [S.], seq 2803260293, ack 1727652906, win 65160, options [mss 1460,sackOK,TS val 2813093482 ecr 1913351594,nop,wscale 7], length 0
19:55:23.910154 IP lucas-HP-Pavilion.45380 > debian-target.https: Flags [S], seq 4253147361, win 64240, options [mss 1460,sackOK,TS val 1913351594 ecr 0,nop,wscale 7], length 0
19:55:23.910175 IP debian-target.https > lucas-HP-Pavilion.45380: Flags [R.], seq 0, ack 4253147362, win 0, length 0
19:55:23.910195 IP lucas-HP-Pavilion.43516 > debian-target.http: Flags [.], ack 1, win 502, options [nop,nop,TS val 1913351594 ecr 2813093482], length 0
19:55:23.910268 IP lucas-HP-Pavilion.43516 > debian-target.http: Flags [R.], seq 1, ack 1, win 502, options [nop,nop,TS val 1913351594 ecr 2813093482], length 0
19:55:24.021813 IP lucas-HP-Pavilion.53616 > debian-target.imaps: Flags [S], seq 1272361250, win 64240, options [mss 1460,sackOK,TS val 1913351706 ecr 0,nop,wscale 7], length 0
19:55:24.021813 IP lucas-HP-Pavilion.49466 > debian-target.telnet: Flags [S], seq 2305832305, win 64240, options [mss 1460,sackOK,TS val 1913351706 ecr 0,nop,wscale 7], length 0
19:55:24.021813 IP lucas-HP-Pavilion.32784 > debian-target.http-alt: Flags [S], seq 2307100062, win 64240, options [mss 1460,sackOK,TS val 1913351706 ecr 0,nop,wscale 7], length 0
19:55:24.021813 IP lucas-HP-Pavilion.59052 > debian-target.pop3: Flags [S], seq 3515303272, win 64240, options [mss 1460,sackOK,TS val 1913351706 ecr 0,nop,wscale 7], length 0
19:55:24.021813 IP lucas-HP-Pavilion.33448 > debian-target.rtsp: Flags [S], seq 1480808696, win 64240, options [mss 1460,sackOK,TS val 1913351706 ecr 0,nop,wscale 7], length 0
19:55:24.021813 IP lucas-HP-Pavilion.41058 > debian-target.microsoft-ds: Flags [S], seq 3218352520, win 64240, options [mss 1460,sackOK,TS val 1913351706 ecr 0,nop,wscale 7], length 0
19:55:24.021813 IP lucas-HP-Pavilion.46798 > debian-target.pop3s: Flags [S], seq 2747404658, win 64240, options [mss 1460,sackOK,TS val 1913351706 ecr 0,nop,wscale 7], length 0
19:55:24.021813 IP lucas-HP-Pavilion.52298 > debian-target.imap2: Flags [S], seq 3384731435, win 64240, options [mss 1460,sackOK,TS val 1913351706 ecr 0,nop,wscale 7], length 0
19:55:24.021924 IP debian-target.imaps > lucas-HP-Pavilion.53616: Flags [R.], seq 0, ack 1272361251, win 0, length 0
19:55:24.021957 IP debian-target.telnet > lucas-HP-Pavilion.49466: Flags [R.], seq 0, ack 2305832306, win 0, length 0
19:55:24.021990 IP debian-target.pop3 > lucas-HP-Pavilion.59052: Flags [R.], seq 0, ack 3515303273, win 0, length 0
19:55:24.022003 IP debian-target.rtsp > lucas-HP-Pavilion.33448: Flags [R.], seq 0, ack 1480808697, win 0, length 0
19:55:24.022010 IP debian-target.microsoft-ds > lucas-HP-Pavilion.41058: Flags [R.], seq 0, ack 3218352521, win 0, length 0
19:55:24.022019 IP debian-target.pop3s > lucas-HP-Pavilion.46798: Flags [R.], seq 0, ack 2747404659, win 0, length 0
19:55:24.022027 IP debian-target.imap2 > lucas-HP-Pavilion.52298: Flags [R.], seq 0, ack 3384731436, win 0, length 0
19:55:24.022037 IP lucas-HP-Pavilion.44256 > debian-target.1025: Flags [S], seq 425334447, win 64240, options [mss 1460,sackOK,TS val 1913351706 ecr 0,nop,wscale 7], length 0
19:55:24.022037 IP lucas-HP-Pavilion.57468 > debian-target.8888: Flags [S], seq 1601821023, win 64240, options [mss 1460,sackOK,TS val 1913351706 ecr 0,nop,wscale 7], length 0
19:55:24.022047 IP debian-target.1025 > lucas-HP-Pavilion.44256: Flags [R.], seq 0, ack 425334448, win 0, length 0
19:55:24.022056 IP debian-target.8888 > lucas-HP-Pavilion.57468: Flags [R.], seq 0, ack 1601821024, win 0, length 0
19:55:24.022107 IP debian-target.http-alt > lucas-HP-Pavilion.32784: Flags [S.], seq 730471816, ack 2307100063, win 65160, options [mss 1460,sackOK,TS val 974455376 ecr 1913351706,nop,wscale 7], length 0
19:55:24.022115 IP lucas-HP-Pavilion.47938 > debian-target.sunrpc: Flags [S], seq 3406549099, win 64240, options [mss 1460,sackOK,TS val 1913351706 ecr 0,nop,wscale 7], length 0
19:55:24.022115 IP lucas-HP-Pavilion.59768 > debian-target.domain: Flags [S], seq 1523293658, win 64240, options [mss 1460,sackOK,TS val 1913351706 ecr 0,nop,wscale 7], length 0
19:55:24.022115 IP lucas-HP-Pavilion.53626 > debian-target.smux: Flags [S], seq 2599567742, win 64240, options [mss 1460,sackOK,TS val 1913351706 ecr 0,nop,wscale 7], length 0
19:55:24.022138 IP debian-target.sunrpc > lucas-HP-Pavilion.47938: Flags [R.], seq 0, ack 3406549100, win 0, length 0
19:55:24.022149 IP debian-target.domain > lucas-HP-Pavilion.59768: Flags [R.], seq 0, ack 1523293659, win 0, length 0
19:55:24.022158 IP debian-target.smux > lucas-HP-Pavilion.53626: Flags [R.], seq 0, ack 2599567743, win 0, length 0
19:55:24.022167 IP lucas-HP-Pavilion.37746 > debian-target.256: Flags [S], seq 658027658, win 64240, options [mss 1460,sackOK,TS val 1913351706 ecr 0,nop,wscale 7], length 0
19:55:24.022167 IP lucas-HP-Pavilion.37474 > debian-target.submission: Flags [S], seq 275105735, win 64240, options [mss 1460,sackOK,TS val 1913351706 ecr 0,nop,wscale 7], length 0
19:55:24.022167 IP lucas-HP-Pavilion.32784 > debian-target.http-alt: Flags [.], ack 1, win 502, options [nop,nop,TS val 1913351706 ecr 974455376], length 0
19:55:24.022167 IP lucas-HP-Pavilion.54288 > debian-target.ssh: Flags [S], seq 740177045, win 64240, options [mss 1460,sackOK,TS val 1913351706 ecr 0,nop,wscale 7], length 0
19:55:24.022168 IP lucas-HP-Pavilion.59222 > debian-target.mysql: Flags [S], seq 1272603476, win 64240, options [mss 1460,sackOK,TS val 1913351706 ecr 0,nop,wscale 7], length 0
19:55:24.022186 IP debian-target.256 > lucas-HP-Pavilion.37746: Flags [R.], seq 0, ack 658027659, win 0, length 0
19:55:24.022195 IP debian-target.submission > lucas-HP-Pavilion.37474: Flags [R.], seq 0, ack 275105736, win 0, length 0
19:55:24.022211 IP debian-target.ssh > lucas-HP-Pavilion.54288: Flags [S.], seq 2702524564, ack 740177046, win 65160, options [mss 1460,sackOK,TS val 2813093594 ecr 1913351706,nop,wscale 7], length 0
19:55:24.022219 IP debian-target.mysql > lucas-HP-Pavilion.59222: Flags [R.], seq 0, ack 1272603477, win 0, length 0
19:55:24.022231 IP lucas-HP-Pavilion.39768 > debian-target.auth: Flags [S], seq 4022299223, win 64240, options [mss 1460,sackOK,TS val 1913351706 ecr 0,nop,wscale 7], length 0
19:55:24.022231 IP lucas-HP-Pavilion.52900 > debian-target.1720: Flags [S], seq 3344893389, win 64240, options [mss 1460,sackOK,TS val 1913351706 ecr 0,nop,wscale 7], length 0
19:55:24.022231 IP lucas-HP-Pavilion.43266 > debian-target.netbios-ssn: Flags [S], seq 3088385791, win 64240, options [mss 1460,sackOK,TS val 1913351706 ecr 0,nop,wscale 7], length 0
19:55:24.022231 IP lucas-HP-Pavilion.46684 > debian-target.smtp: Flags [S], seq 473243055, win 64240, options [mss 1460,sackOK,TS val 1913351706 ecr 0,nop,wscale 7], length 0
19:55:24.022231 IP lucas-HP-Pavilion.54288 > debian-target.ssh: Flags [.], ack 1, win 502, options [nop,nop,TS val 1913351706 ecr 2813093594], length 0
19:55:24.022249 IP debian-target.auth > lucas-HP-Pavilion.39768: Flags [R.], seq 0, ack 4022299224, win 0, length 0
19:55:24.022258 IP debian-target.1720 > lucas-HP-Pavilion.52900: Flags [R.], seq 0, ack 3344893390, win 0, length 0
19:55:24.022266 IP debian-target.netbios-ssn > lucas-HP-Pavilion.43266: Flags [R.], seq 0, ack 3088385792, win 0, length 0
19:55:24.022274 IP debian-target.smtp > lucas-HP-Pavilion.46684: Flags [R.], seq 0, ack 473243056, win 0, length 0
19:55:24.022308 IP lucas-HP-Pavilion.43528 > debian-target.http: Flags [S], seq 1972833930, win 64240, options [mss 1460,sackOK,TS val 1913351706 ecr 0,nop,wscale 7], length 0
19:55:24.022308 IP lucas-HP-Pavilion.32784 > debian-target.http-alt: Flags [R.], seq 1, ack 1, win 502, options [nop,nop,TS val 1913351706 ecr 974455376], length 0
19:55:24.022309 IP lucas-HP-Pavilion.54288 > debian-target.ssh: Flags [R.], seq 1, ack 1, win 502, options [nop,nop,TS val 1913351706 ecr 2813093594], length 0
19:55:24.022322 IP debian-target.http > lucas-HP-Pavilion.43528: Flags [S.], seq 1583691861, ack 1972833931, win 65160, options [mss 1460,sackOK,TS val 2813093594 ecr 1913351706,nop,wscale 7], length 0
19:55:24.022354 IP lucas-HP-Pavilion.43528 > debian-target.http: Flags [.], ack 1, win 502, options [nop,nop,TS val 1913351706 ecr 2813093594], length 0
19:55:24.022354 IP lucas-HP-Pavilion.42870 > debian-target.ms-wbt-server: Flags [S], seq 1700117533, win 64240, options [mss 1460,sackOK,TS val 1913351706 ecr 0,nop,wscale 7], length 0
19:55:24.022368 IP debian-target.ms-wbt-server > lucas-HP-Pavilion.42870: Flags [R.], seq 0, ack 1700117534, win 0, length 0
19:55:24.022375 IP lucas-HP-Pavilion.52256 > debian-target.5900: Flags [S], seq 1129827062, win 64240, options [mss 1460,sackOK,TS val 1913351706 ecr 0,nop,wscale 7], length 0
19:55:24.022375 IP lucas-HP-Pavilion.36062 > debian-target.ftp: Flags [S], seq 3850595934, win 64240, options [mss 1460,sackOK,TS val 1913351706 ecr 0,nop,wscale 7], length 0
19:55:24.022388 IP debian-target.5900 > lucas-HP-Pavilion.52256: Flags [R.], seq 0, ack 1129827063, win 0, length 0
19:55:24.022396 IP debian-target.ftp > lucas-HP-Pavilion.36062: Flags [R.], seq 0, ack 3850595935, win 0, length 0
19:55:24.022412 IP lucas-HP-Pavilion.45394 > debian-target.https: Flags [S], seq 3333396745, win 64240, options [mss 1460,sackOK,TS val 1913351706 ecr 0,nop,wscale 7], length 0
19:55:24.022412 IP lucas-HP-Pavilion.46046 > debian-target.1723: Flags [S], seq 2263166503, win 64240, options [mss 1460,sackOK,TS val 1913351706 ecr 0,nop,wscale 7], length 0
19:55:24.022421 IP debian-target.https > lucas-HP-Pavilion.45394: Flags [R.], seq 0, ack 3333396746, win 0, length 0
19:55:24.022429 IP debian-target.1723 > lucas-HP-Pavilion.46046: Flags [R.], seq 0, ack 2263166504, win 0, length 0
19:55:24.022436 IP lucas-HP-Pavilion.60162 > debian-target.epmap: Flags [S], seq 2252645154, win 64240, options [mss 1460,sackOK,TS val 1913351706 ecr 0,nop,wscale 7], length 0
19:55:24.022436 IP lucas-HP-Pavilion.45458 > debian-target.2191: Flags [S], seq 168527498, win 64240, options [mss 1460,sackOK,TS val 1913351706 ecr 0,nop,wscale 7], length 0
19:55:24.022436 IP lucas-HP-Pavilion.42552 > debian-target.33899: Flags [S], seq 3679013034, win 64240, options [mss 1460,sackOK,TS val 1913351706 ecr 0,nop,wscale 7], length 0
19:55:24.022447 IP debian-target.epmap > lucas-HP-Pavilion.60162: Flags [R.], seq 0, ack 2252645155, win 0, length 0
19:55:24.022458 IP debian-target.2191 > lucas-HP-Pavilion.45458: Flags [R.], seq 0, ack 168527499, win 0, length 0
19:55:24.022466 IP debian-target.33899 > lucas-HP-Pavilion.42552: Flags [R.], seq 0, ack 3679013035, win 0, length 0
19:55:24.022474 IP lucas-HP-Pavilion.35454 > debian-target.x11-4: Flags [S], seq 3032164227, win 64240, options [mss 1460,sackOK,TS val 1913351706 ecr 0,nop,wscale 7], length 0
19:55:24.022474 IP lucas-HP-Pavilion.41640 > debian-target.8009: Flags [S], seq 2022110784, win 64240, options [mss 1460,sackOK,TS val 1913351706 ecr 0,nop,wscale 7], length 0
19:55:24.022474 IP lucas-HP-Pavilion.46556 > debian-target.4449: Flags [S], seq 162053874, win 64240, options [mss 1460,sackOK,TS val 1913351706 ecr 0,nop,wscale 7], length 0
19:55:24.022491 IP debian-target.x11-4 > lucas-HP-Pavilion.35454: Flags [R.], seq 0, ack 3032164228, win 0, length 0
19:55:24.022499 IP debian-target.8009 > lucas-HP-Pavilion.41640: Flags [R.], seq 0, ack 2022110785, win 0, length 0
19:55:24.022506 IP debian-target.4449 > lucas-HP-Pavilion.46556: Flags [R.], seq 0, ack 162053875, win 0, length 0
19:55:24.022512 IP lucas-HP-Pavilion.47130 > debian-target.1067: Flags [S], seq 1958524407, win 64240, options [mss 1460,sackOK,TS val 1913351706 ecr 0,nop,wscale 7], length 0
19:55:24.022513 IP lucas-HP-Pavilion.59314 > debian-target.33354: Flags [S], seq 3828539254, win 64240, options [mss 1460,sackOK,TS val 1913351706 ecr 0,nop,wscale 7], length 0
19:55:24.022513 IP lucas-HP-Pavilion.42598 > debian-target.2030: Flags [S], seq 3640554221, win 64240, options [mss 1460,sackOK,TS val 1913351706 ecr 0,nop,wscale 7], length 0
19:55:24.022523 IP debian-target.1067 > lucas-HP-Pavilion.47130: Flags [R.], seq 0, ack 1958524408, win 0, length 0
19:55:24.022533 IP debian-target.33354 > lucas-HP-Pavilion.59314: Flags [R.], seq 0, ack 3828539255, win 0, length 0
19:55:24.022556 IP debian-target.2030 > lucas-HP-Pavilion.42598: Flags [R.], seq 0, ack 3640554222, win 0, length 0
19:55:24.022563 IP lucas-HP-Pavilion.52766 > debian-target.1082: Flags [S], seq 2860747462, win 64240, options [mss 1460,sackOK,TS val 1913351706 ecr 0,nop,wscale 7], length 0
19:55:24.022563 IP lucas-HP-Pavilion.53806 > debian-target.7019: Flags [S], seq 3771809239, win 64240, options [mss 1460,sackOK,TS val 1913351706 ecr 0,nop,wscale 7], length 0
19:55:24.022575 IP debian-target.1082 > lucas-HP-Pavilion.52766: Flags [R.], seq 0, ack 2860747463, win 0, length 0
19:55:24.022584 IP debian-target.7019 > lucas-HP-Pavilion.53806: Flags [R.], seq 0, ack 3771809240, win 0, length 0
19:55:24.022595 IP lucas-HP-Pavilion.56996 > debian-target.gopher: Flags [S], seq 1569475999, win 64240, options [mss 1460,sackOK,TS val 1913351707 ecr 0,nop,wscale 7], length 0
19:55:24.022595 IP lucas-HP-Pavilion.40342 > debian-target.667: Flags [S], seq 965757159, win 64240, options [mss 1460,sackOK,TS val 1913351707 ecr 0,nop,wscale 7], length 0
19:55:24.022607 IP debian-target.gopher > lucas-HP-Pavilion.56996: Flags [R.], seq 0, ack 1569476000, win 0, length 0
19:55:24.022615 IP debian-target.667 > lucas-HP-Pavilion.40342: Flags [R.], seq 0, ack 965757160, win 0, length 0
19:55:24.022621 IP lucas-HP-Pavilion.34478 > debian-target.1069: Flags [S], seq 923059243, win 64240, options [mss 1460,sackOK,TS val 1913351707 ecr 0,nop,wscale 7], length 0
19:55:24.022621 IP lucas-HP-Pavilion.57550 > debian-target.nut: Flags [S], seq 909374210, win 64240, options [mss 1460,sackOK,TS val 1913351707 ecr 0,nop,wscale 7], length 0
19:55:24.022630 IP debian-target.1069 > lucas-HP-Pavilion.34478: Flags [R.], seq 0, ack 923059244, win 0, length 0
19:55:24.022639 IP debian-target.nut > lucas-HP-Pavilion.57550: Flags [R.], seq 0, ack 909374211, win 0, length 0
19:55:24.022645 IP lucas-HP-Pavilion.52500 > debian-target.50001: Flags [S], seq 1765856700, win 64240, options [mss 1460,sackOK,TS val 1913351707 ecr 0,nop,wscale 7], length 0
19:55:24.022652 IP debian-target.50001 > lucas-HP-Pavilion.52500: Flags [R.], seq 0, ack 1765856701, win 0, length 0
19:55:24.022660 IP lucas-HP-Pavilion.60042 > debian-target.5080: Flags [S], seq 926736512, win 64240, options [mss 1460,sackOK,TS val 1913351707 ecr 0,nop,wscale 7], length 0
19:55:24.022667 IP debian-target.5080 > lucas-HP-Pavilion.60042: Flags [R.], seq 0, ack 926736513, win 0, length 0
19:55:24.022676 IP lucas-HP-Pavilion.47962 > debian-target.2875: Flags [S], seq 1967846748, win 64240, options [mss 1460,sackOK,TS val 1913351707 ecr 0,nop,wscale 7], length 0
19:55:24.022686 IP debian-target.2875 > lucas-HP-Pavilion.47962: Flags [R.], seq 0, ack 1967846749, win 0, length 0
19:55:24.022692 IP lucas-HP-Pavilion.54726 > debian-target.1296: Flags [S], seq 2831732180, win 64240, options [mss 1460,sackOK,TS val 1913351707 ecr 0,nop,wscale 7], length 0
19:55:24.022701 IP debian-target.1296 > lucas-HP-Pavilion.54726: Flags [R.], seq 0, ack 2831732181, win 0, length 0
19:55:24.022708 IP lucas-HP-Pavilion.35764 > debian-target.1065: Flags [S], seq 151804879, win 64240, options [mss 1460,sackOK,TS val 1913351707 ecr 0,nop,wscale 7], length 0
19:55:24.022708 IP lucas-HP-Pavilion.57450 > debian-target.2725: Flags [S], seq 3920323780, win 64240, options [mss 1460,sackOK,TS val 1913351707 ecr 0,nop,wscale 7], length 0
19:55:24.022716 IP debian-target.1065 > lucas-HP-Pavilion.35764: Flags [R.], seq 0, ack 151804880, win 0, length 0
19:55:24.022730 IP debian-target.2725 > lucas-HP-Pavilion.57450: Flags [R.], seq 0, ack 3920323781, win 0, length 0
19:55:24.022736 IP lucas-HP-Pavilion.32804 > debian-target.5907: Flags [S], seq 801414511, win 64240, options [mss 1460,sackOK,TS val 1913351707 ecr 0,nop,wscale 7], length 0
19:55:24.022745 IP debian-target.5907 > lucas-HP-Pavilion.32804: Flags [R.], seq 0, ack 801414512, win 0, length 0
19:55:24.022752 IP lucas-HP-Pavilion.44140 > debian-target.3001: Flags [S], seq 2816381782, win 64240, options [mss 1460,sackOK,TS val 1913351707 ecr 0,nop,wscale 7], length 0
19:55:24.022753 IP lucas-HP-Pavilion.47424 > debian-target.1130: Flags [S], seq 786748948, win 64240, options [mss 1460,sackOK,TS val 1913351707 ecr 0,nop,wscale 7], length 0
19:55:24.022761 IP debian-target.3001 > lucas-HP-Pavilion.44140: Flags [R.], seq 0, ack 2816381783, win 0, length 0
19:55:24.022770 IP debian-target.1130 > lucas-HP-Pavilion.47424: Flags [R.], seq 0, ack 786748949, win 0, length 0
19:55:24.022777 IP lucas-HP-Pavilion.35484 > debian-target.82: Flags [S], seq 2064201557, win 64240, options [mss 1460,sackOK,TS val 1913351707 ecr 0,nop,wscale 7], length 0
19:55:24.022783 IP debian-target.82 > lucas-HP-Pavilion.35484: Flags [R.], seq 0, ack 2064201558, win 0, length 0
19:55:24.022793 IP lucas-HP-Pavilion.43528 > debian-target.http: Flags [R.], seq 1, ack 1, win 502, options [nop,nop,TS val 1913351707 ecr 2813093594], length 0
19:55:24.022911 IP lucas-HP-Pavilion.45632 > debian-target.8031: Flags [S], seq 2867172593, win 64240, options [mss 1460,sackOK,TS val 1913351707 ecr 0,nop,wscale 7], length 0
19:55:24.022926 IP debian-target.8031 > lucas-HP-Pavilion.45632: Flags [R.], seq 0, ack 2867172594, win 0, length 0
19:55:24.022934 IP lucas-HP-Pavilion.44884 > debian-target.3814: Flags [S], seq 2647188268, win 64240, options [mss 1460,sackOK,TS val 1913351707 ecr 0,nop,wscale 7], length 0
19:55:24.022934 IP lucas-HP-Pavilion.51544 > debian-target.8300: Flags [S], seq 3458915118, win 64240, options [mss 1460,sackOK,TS val 1913351707 ecr 0,nop,wscale 7], length 0
19:55:24.022964 IP debian-target.3814 > lucas-HP-Pavilion.44884: Flags [R.], seq 0, ack 2647188269, win 0, length 0
19:55:24.022973 IP debian-target.8300 > lucas-HP-Pavilion.51544: Flags [R.], seq 0, ack 3458915119, win 0, length 0
19:55:24.022982 IP lucas-HP-Pavilion.35608 > debian-target.30718: Flags [S], seq 3269997409, win 64240, options [mss 1460,sackOK,TS val 1913351707 ecr 0,nop,wscale 7], length 0
19:55:24.022982 IP lucas-HP-Pavilion.43510 > debian-target.1106: Flags [S], seq 3877757462, win 64240, options [mss 1460,sackOK,TS val 1913351707 ecr 0,nop,wscale 7], length 0
19:55:24.022982 IP lucas-HP-Pavilion.56552 > debian-target.tcpmux: Flags [S], seq 4210601366, win 64240, options [mss 1460,sackOK,TS val 1913351707 ecr 0,nop,wscale 7], length 0
19:55:24.022997 IP debian-target.30718 > lucas-HP-Pavilion.35608: Flags [R.], seq 0, ack 3269997410, win 0, length 0
19:55:24.023005 IP debian-target.1106 > lucas-HP-Pavilion.43510: Flags [R.], seq 0, ack 3877757463, win 0, length 0
19:55:24.023012 IP debian-target.tcpmux > lucas-HP-Pavilion.56552: Flags [R.], seq 0, ack 4210601367, win 0, length 0
19:55:24.023030 IP lucas-HP-Pavilion.46248 > debian-target.1009: Flags [S], seq 4187445473, win 64240, options [mss 1460,sackOK,TS val 1913351707 ecr 0,nop,wscale 7], length 0
19:55:24.023030 IP lucas-HP-Pavilion.38410 > debian-target.8090: Flags [S], seq 3682470755, win 64240, options [mss 1460,sackOK,TS val 1913351707 ecr 0,nop,wscale 7], length 0
19:55:24.023030 IP lucas-HP-Pavilion.51302 > debian-target.5877: Flags [S], seq 902479494, win 64240, options [mss 1460,sackOK,TS val 1913351707 ecr 0,nop,wscale 7], length 0
19:55:24.023041 IP debian-target.1009 > lucas-HP-Pavilion.46248: Flags [R.], seq 0, ack 4187445474, win 0, length 0
19:55:24.023049 IP debian-target.8090 > lucas-HP-Pavilion.38410: Flags [R.], seq 0, ack 3682470756, win 0, length 0
19:55:24.023056 IP debian-target.5877 > lucas-HP-Pavilion.51302: Flags [R.], seq 0, ack 902479495, win 0, length 0
19:55:24.023063 IP lucas-HP-Pavilion.47398 > debian-target.8600: Flags [S], seq 1212990771, win 64240, options [mss 1460,sackOK,TS val 1913351707 ecr 0,nop,wscale 7], length 0
19:55:24.023063 IP lucas-HP-Pavilion.48718 > debian-target.2107: Flags [S], seq 2587052533, win 64240, options [mss 1460,sackOK,TS val 1913351707 ecr 0,nop,wscale 7], length 0
19:55:24.023063 IP lucas-HP-Pavilion.48040 > debian-target.56737: Flags [S], seq 1125789261, win 64240, options [mss 1460,sackOK,TS val 1913351707 ecr 0,nop,wscale 7], length 0
19:55:24.023063 IP lucas-HP-Pavilion.54078 > debian-target.1300: Flags [S], seq 3820857994, win 64240, options [mss 1460,sackOK,TS val 1913351707 ecr 0,nop,wscale 7], length 0
19:55:24.023080 IP debian-target.8600 > lucas-HP-Pavilion.47398: Flags [R.], seq 0, ack 1212990772, win 0, length 0
19:55:24.023088 IP debian-target.2107 > lucas-HP-Pavilion.48718: Flags [R.], seq 0, ack 2587052534, win 0, length 0
19:55:24.023095 IP debian-target.56737 > lucas-HP-Pavilion.48040: Flags [R.], seq 0, ack 1125789262, win 0, length 0
19:55:24.023105 IP debian-target.1300 > lucas-HP-Pavilion.54078: Flags [R.], seq 0, ack 3820857995, win 0, length 0
19:55:24.023112 IP lucas-HP-Pavilion.54956 > debian-target.9000: Flags [S], seq 1864155751, win 64240, options [mss 1460,sackOK,TS val 1913351707 ecr 0,nop,wscale 7], length 0
19:55:24.023112 IP lucas-HP-Pavilion.36574 > debian-target.2005: Flags [S], seq 73892481, win 64240, options [mss 1460,sackOK,TS val 1913351707 ecr 0,nop,wscale 7], length 0
19:55:24.023112 IP lucas-HP-Pavilion.58988 > debian-target.5950: Flags [S], seq 1764142451, win 64240, options [mss 1460,sackOK,TS val 1913351707 ecr 0,nop,wscale 7], length 0
19:55:24.023112 IP lucas-HP-Pavilion.55118 > debian-target.18101: Flags [S], seq 1990805613, win 64240, options [mss 1460,sackOK,TS val 1913351707 ecr 0,nop,wscale 7], length 0
19:55:24.023128 IP debian-target.9000 > lucas-HP-Pavilion.54956: Flags [R.], seq 0, ack 1864155752, win 0, length 0
19:55:24.023137 IP debian-target.2005 > lucas-HP-Pavilion.36574: Flags [R.], seq 0, ack 73892482, win 0, length 0
19:55:24.023144 IP debian-target.5950 > lucas-HP-Pavilion.58988: Flags [R.], seq 0, ack 1764142452, win 0, length 0
19:55:24.023151 IP debian-target.18101 > lucas-HP-Pavilion.55118: Flags [R.], seq 0, ack 1990805614, win 0, length 0
19:55:24.023158 IP lucas-HP-Pavilion.35828 > debian-target.8045: Flags [S], seq 789019068, win 64240, options [mss 1460,sackOK,TS val 1913351707 ecr 0,nop,wscale 7], length 0
19:55:24.023158 IP lucas-HP-Pavilion.43438 > debian-target.9011: Flags [S], seq 4238992461, win 64240, options [mss 1460,sackOK,TS val 1913351707 ecr 0,nop,wscale 7], length 0
19:55:24.023158 IP lucas-HP-Pavilion.56976 > debian-target.3880: Flags [S], seq 2930613568, win 64240, options [mss 1460,sackOK,TS val 1913351707 ecr 0,nop,wscale 7], length 0
19:55:24.023173 IP debian-target.8045 > lucas-HP-Pavilion.35828: Flags [R.], seq 0, ack 789019069, win 0, length 0
19:55:24.023182 IP debian-target.9011 > lucas-HP-Pavilion.43438: Flags [R.], seq 0, ack 4238992462, win 0, length 0
19:55:24.023189 IP debian-target.3880 > lucas-HP-Pavilion.56976: Flags [R.], seq 0, ack 2930613569, win 0, length 0
19:55:24.023196 IP lucas-HP-Pavilion.60502 > debian-target.3052: Flags [S], seq 4144343728, win 64240, options [mss 1460,sackOK,TS val 1913351707 ecr 0,nop,wscale 7], length 0
19:55:24.023196 IP lucas-HP-Pavilion.50200 > debian-target.3878: Flags [S], seq 1741273406, win 64240, options [mss 1460,sackOK,TS val 1913351707 ecr 0,nop,wscale 7], length 0
19:55:24.023196 IP lucas-HP-Pavilion.37184 > debian-target.89: Flags [S], seq 1202973734, win 64240, options [mss 1460,sackOK,TS val 1913351707 ecr 0,nop,wscale 7], length 0
19:55:24.023210 IP debian-target.3052 > lucas-HP-Pavilion.60502: Flags [R.], seq 0, ack 4144343729, win 0, length 0
19:55:24.023220 IP debian-target.3878 > lucas-HP-Pavilion.50200: Flags [R.], seq 0, ack 1741273407, win 0, length 0
19:55:24.023227 IP debian-target.89 > lucas-HP-Pavilion.37184: Flags [R.], seq 0, ack 1202973735, win 0, length 0
19:55:24.023234 IP lucas-HP-Pavilion.53588 > debian-target.6580: Flags [S], seq 3759475034, win 64240, options [mss 1460,sackOK,TS val 1913351707 ecr 0,nop,wscale 7], length 0
19:55:24.023234 IP lucas-HP-Pavilion.36838 > debian-target.git: Flags [S], seq 3368503906, win 64240, options [mss 1460,sackOK,TS val 1913351707 ecr 0,nop,wscale 7], length 0
19:55:24.023234 IP lucas-HP-Pavilion.51542 > debian-target.3013: Flags [S], seq 2347145016, win 64240, options [mss 1460,sackOK,TS val 1913351707 ecr 0,nop,wscale 7], length 0
19:55:24.023248 IP debian-target.6580 > lucas-HP-Pavilion.53588: Flags [R.], seq 0, ack 3759475035, win 0, length 0
19:55:24.023256 IP debian-target.git > lucas-HP-Pavilion.36838: Flags [R.], seq 0, ack 3368503907, win 0, length 0
19:55:24.023263 IP debian-target.3013 > lucas-HP-Pavilion.51542: Flags [R.], seq 0, ack 2347145017, win 0, length 0
19:55:24.023270 IP lucas-HP-Pavilion.58510 > debian-target.1138: Flags [S], seq 466084432, win 64240, options [mss 1460,sackOK,TS val 1913351707 ecr 0,nop,wscale 7], length 0
19:55:24.023270 IP lucas-HP-Pavilion.38428 > debian-target.2492: Flags [S], seq 3203266037, win 64240, options [mss 1460,sackOK,TS val 1913351707 ecr 0,nop,wscale 7], length 0
19:55:24.023270 IP lucas-HP-Pavilion.42690 > debian-target.shell: Flags [S], seq 1400066833, win 64240, options [mss 1460,sackOK,TS val 1913351707 ecr 0,nop,wscale 7], length 0
19:55:24.023284 IP debian-target.1138 > lucas-HP-Pavilion.58510: Flags [R.], seq 0, ack 466084433, win 0, length 0
19:55:24.023294 IP debian-target.2492 > lucas-HP-Pavilion.38428: Flags [R.], seq 0, ack 3203266038, win 0, length 0
19:55:24.023301 IP debian-target.shell > lucas-HP-Pavilion.42690: Flags [R.], seq 0, ack 1400066834, win 0, length 0
19:55:24.023307 IP lucas-HP-Pavilion.34476 > debian-target.1533: Flags [S], seq 1355440426, win 64240, options [mss 1460,sackOK,TS val 1913351707 ecr 0,nop,wscale 7], length 0
19:55:24.023307 IP lucas-HP-Pavilion.33268 > debian-target.1042: Flags [S], seq 3084780271, win 64240, options [mss 1460,sackOK,TS val 1913351707 ecr 0,nop,wscale 7], length 0
19:55:24.023308 IP lucas-HP-Pavilion.43312 > debian-target.1123: Flags [S], seq 209861772, win 64240, options [mss 1460,sackOK,TS val 1913351707 ecr 0,nop,wscale 7], length 0
19:55:24.023321 IP debian-target.1533 > lucas-HP-Pavilion.34476: Flags [R.], seq 0, ack 1355440427, win 0, length 0
19:55:24.023329 IP debian-target.1042 > lucas-HP-Pavilion.33268: Flags [R.], seq 0, ack 3084780272, win 0, length 0
19:55:24.023337 IP debian-target.1123 > lucas-HP-Pavilion.43312: Flags [R.], seq 0, ack 209861773, win 0, length 0
19:55:24.023344 IP lucas-HP-Pavilion.37482 > debian-target.7937: Flags [S], seq 616395396, win 64240, options [mss 1460,sackOK,TS val 1913351707 ecr 0,nop,wscale 7], length 0
19:55:24.023344 IP lucas-HP-Pavilion.45920 > debian-target.1310: Flags [S], seq 600525360, win 64240, options [mss 1460,sackOK,TS val 1913351707 ecr 0,nop,wscale 7], length 0
19:55:24.023344 IP lucas-HP-Pavilion.39066 > debian-target.16992: Flags [S], seq 3427035766, win 64240, options [mss 1460,sackOK,TS val 1913351707 ecr 0,nop,wscale 7], length 0
19:55:24.023354 IP debian-target.7937 > lucas-HP-Pavilion.37482: Flags [R.], seq 0, ack 616395397, win 0, length 0
19:55:24.023363 IP debian-target.1310 > lucas-HP-Pavilion.45920: Flags [R.], seq 0, ack 600525361, win 0, length 0
19:55:24.023369 IP debian-target.16992 > lucas-HP-Pavilion.39066: Flags [R.], seq 0, ack 3427035767, win 0, length 0
19:55:24.023373 IP lucas-HP-Pavilion.49772 > debian-target.kpasswd: Flags [S], seq 3263572419, win 64240, options [mss 1460,sackOK,TS val 1913351707 ecr 0,nop,wscale 7], length 0
19:55:24.023373 IP lucas-HP-Pavilion.54670 > debian-target.1863: Flags [S], seq 798103386, win 64240, options [mss 1460,sackOK,TS val 1913351707 ecr 0,nop,wscale 7], length 0
19:55:24.023380 IP debian-target.kpasswd > lucas-HP-Pavilion.49772: Flags [R.], seq 0, ack 3263572420, win 0, length 0
19:55:24.023390 IP debian-target.1863 > lucas-HP-Pavilion.54670: Flags [R.], seq 0, ack 798103387, win 0, length 0
19:55:24.023394 IP lucas-HP-Pavilion.36252 > debian-target.1110: Flags [S], seq 837310143, win 64240, options [mss 1460,sackOK,TS val 1913351707 ecr 0,nop,wscale 7], length 0
19:55:24.023402 IP debian-target.1110 > lucas-HP-Pavilion.36252: Flags [R.], seq 0, ack 837310144, win 0, length 0
19:55:24.023408 IP lucas-HP-Pavilion.54542 > debian-target.zebra: Flags [S], seq 2852764579, win 64240, options [mss 1460,sackOK,TS val 1913351707 ecr 0,nop,wscale 7], length 0
19:55:24.023414 IP debian-target.zebra > lucas-HP-Pavilion.54542: Flags [R.], seq 0, ack 2852764580, win 0, length 0
19:55:24.023421 IP lucas-HP-Pavilion.59506 > debian-target.1031: Flags [S], seq 1993772868, win 64240, options [mss 1460,sackOK,TS val 1913351707 ecr 0,nop,wscale 7], length 0
19:55:24.023426 IP debian-target.1031 > lucas-HP-Pavilion.59506: Flags [R.], seq 0, ack 1993772869, win 0, length 0
19:55:24.023434 IP lucas-HP-Pavilion.38354 > debian-target.4003: Flags [S], seq 927472112, win 64240, options [mss 1460,sackOK,TS val 1913351707 ecr 0,nop,wscale 7], length 0
19:55:24.023439 IP debian-target.4003 > lucas-HP-Pavilion.38354: Flags [R.], seq 0, ack 927472113, win 0, length 0
19:55:24.023452 IP lucas-HP-Pavilion.52712 > debian-target.2500: Flags [S], seq 1374938894, win 64240, options [mss 1460,sackOK,TS val 1913351707 ecr 0,nop,wscale 7], length 0
19:55:24.023460 IP debian-target.2500 > lucas-HP-Pavilion.52712: Flags [R.], seq 0, ack 1374938895, win 0, length 0
19:55:24.023465 IP lucas-HP-Pavilion.55826 > debian-target.6059: Flags [S], seq 875402357, win 64240, options [mss 1460,sackOK,TS val 1913351707 ecr 0,nop,wscale 7], length 0
19:55:24.023465 IP lucas-HP-Pavilion.56994 > debian-target.32772: Flags [S], seq 2493938804, win 64240, options [mss 1460,sackOK,TS val 1913351707 ecr 0,nop,wscale 7], length 0
19:55:24.023473 IP debian-target.6059 > lucas-HP-Pavilion.55826: Flags [R.], seq 0, ack 875402358, win 0, length 0
19:55:24.023480 IP debian-target.32772 > lucas-HP-Pavilion.56994: Flags [R.], seq 0, ack 2493938805, win 0, length 0
19:55:24.023485 IP lucas-HP-Pavilion.52036 > debian-target.6129: Flags [S], seq 3639625003, win 64240, options [mss 1460,sackOK,TS val 1913351707 ecr 0,nop,wscale 7], length 0
19:55:24.023490 IP debian-target.6129 > lucas-HP-Pavilion.52036: Flags [R.], seq 0, ack 3639625004, win 0, length 0
19:55:24.023504 IP lucas-HP-Pavilion.48690 > debian-target.668: Flags [S], seq 444444288, win 64240, options [mss 1460,sackOK,TS val 1913351707 ecr 0,nop,wscale 7], length 0
19:55:24.023504 IP lucas-HP-Pavilion.34736 > debian-target.5001: Flags [S], seq 856520493, win 64240, options [mss 1460,sackOK,TS val 1913351707 ecr 0,nop,wscale 7], length 0
19:55:24.023512 IP debian-target.668 > lucas-HP-Pavilion.48690: Flags [R.], seq 0, ack 444444289, win 0, length 0
19:55:24.023521 IP debian-target.5001 > lucas-HP-Pavilion.34736: Flags [R.], seq 0, ack 856520494, win 0, length 0
19:55:24.023528 IP lucas-HP-Pavilion.52246 > debian-target.1233: Flags [S], seq 4167683575, win 64240, options [mss 1460,sackOK,TS val 1913351707 ecr 0,nop,wscale 7], length 0
19:55:24.023534 IP debian-target.1233 > lucas-HP-Pavilion.52246: Flags [R.], seq 0, ack 4167683576, win 0, length 0
19:55:24.023548 IP lucas-HP-Pavilion.57674 > debian-target.32778: Flags [S], seq 3734284030, win 64240, options [mss 1460,sackOK,TS val 1913351707 ecr 0,nop,wscale 7], length 0
19:55:24.023556 IP debian-target.32778 > lucas-HP-Pavilion.57674: Flags [R.], seq 0, ack 3734284031, win 0, length 0
19:55:24.023561 IP lucas-HP-Pavilion.44938 > debian-target.4343: Flags [S], seq 3550368201, win 64240, options [mss 1460,sackOK,TS val 1913351707 ecr 0,nop,wscale 7], length 0
19:55:24.023567 IP debian-target.4343 > lucas-HP-Pavilion.44938: Flags [R.], seq 0, ack 3550368202, win 0, length 0
19:55:24.023757 IP lucas-HP-Pavilion.48930 > debian-target.1947: Flags [S], seq 3146349841, win 64240, options [mss 1460,sackOK,TS val 1913351708 ecr 0,nop,wscale 7], length 0
19:55:24.023769 IP debian-target.1947 > lucas-HP-Pavilion.48930: Flags [R.], seq 0, ack 3146349842, win 0, length 0
19:55:24.023777 IP lucas-HP-Pavilion.57598 > debian-target.981: Flags [S], seq 125249520, win 64240, options [mss 1460,sackOK,TS val 1913351708 ecr 0,nop,wscale 7], length 0
19:55:24.023783 IP debian-target.981 > lucas-HP-Pavilion.57598: Flags [R.], seq 0, ack 125249521, win 0, length 0
19:55:24.023791 IP lucas-HP-Pavilion.58346 > debian-target.1111: Flags [S], seq 1139114774, win 64240, options [mss 1460,sackOK,TS val 1913351708 ecr 0,nop,wscale 7], length 0
19:55:24.023798 IP debian-target.1111 > lucas-HP-Pavilion.58346: Flags [R.], seq 0, ack 1139114775, win 0, length 0
19:55:24.023803 IP lucas-HP-Pavilion.56688 > debian-target.5214: Flags [S], seq 879387588, win 64240, options [mss 1460,sackOK,TS val 1913351708 ecr 0,nop,wscale 7], length 0
19:55:24.023811 IP debian-target.5214 > lucas-HP-Pavilion.56688: Flags [R.], seq 0, ack 879387589, win 0, length 0
19:55:24.023816 IP lucas-HP-Pavilion.36294 > debian-target.8291: Flags [S], seq 898699153, win 64240, options [mss 1460,sackOK,TS val 1913351708 ecr 0,nop,wscale 7], length 0
19:55:24.023824 IP debian-target.8291 > lucas-HP-Pavilion.36294: Flags [R.], seq 0, ack 898699154, win 0, length 0
19:55:24.023829 IP lucas-HP-Pavilion.43214 > debian-target.987: Flags [S], seq 4234153978, win 64240, options [mss 1460,sackOK,TS val 1913351708 ecr 0,nop,wscale 7], length 0
19:55:24.023837 IP debian-target.987 > lucas-HP-Pavilion.43214: Flags [R.], seq 0, ack 4234153979, win 0, length 0
19:55:24.023842 IP lucas-HP-Pavilion.41598 > debian-target.cvspserver: Flags [S], seq 3056820119, win 64240, options [mss 1460,sackOK,TS val 1913351708 ecr 0,nop,wscale 7], length 0
19:55:24.023847 IP debian-target.cvspserver > lucas-HP-Pavilion.41598: Flags [R.], seq 0, ack 3056820120, win 0, length 0
19:55:24.023852 IP lucas-HP-Pavilion.43664 > debian-target.8254: Flags [S], seq 431094759, win 64240, options [mss 1460,sackOK,TS val 1913351708 ecr 0,nop,wscale 7], length 0
19:55:24.023860 IP debian-target.8254 > lucas-HP-Pavilion.43664: Flags [R.], seq 0, ack 431094760, win 0, length 0
19:55:24.023865 IP lucas-HP-Pavilion.42900 > debian-target.22939: Flags [S], seq 2210134933, win 64240, options [mss 1460,sackOK,TS val 1913351708 ecr 0,nop,wscale 7], length 0
19:55:24.023870 IP debian-target.22939 > lucas-HP-Pavilion.42900: Flags [R.], seq 0, ack 2210134934, win 0, length 0
19:55:24.023878 IP lucas-HP-Pavilion.35406 > debian-target.16001: Flags [S], seq 3069458760, win 64240, options [mss 1460,sackOK,TS val 1913351708 ecr 0,nop,wscale 7], length 0
19:55:24.023883 IP debian-target.16001 > lucas-HP-Pavilion.35406: Flags [R.], seq 0, ack 3069458761, win 0, length 0
19:55:24.023891 IP lucas-HP-Pavilion.54654 > debian-target.49155: Flags [S], seq 3547214044, win 64240, options [mss 1460,sackOK,TS val 1913351708 ecr 0,nop,wscale 7], length 0
19:55:24.023896 IP debian-target.49155 > lucas-HP-Pavilion.54654: Flags [R.], seq 0, ack 3547214045, win 0, length 0
19:55:24.023903 IP lucas-HP-Pavilion.46752 > debian-target.55055: Flags [S], seq 2728440230, win 64240, options [mss 1460,sackOK,TS val 1913351708 ecr 0,nop,wscale 7], length 0
19:55:24.023909 IP debian-target.55055 > lucas-HP-Pavilion.46752: Flags [R.], seq 0, ack 2728440231, win 0, length 0
19:55:24.023916 IP lucas-HP-Pavilion.33362 > debian-target.1935: Flags [S], seq 3786622503, win 64240, options [mss 1460,sackOK,TS val 1913351708 ecr 0,nop,wscale 7], length 0
19:55:24.023922 IP debian-target.1935 > lucas-HP-Pavilion.33362: Flags [R.], seq 0, ack 3786622504, win 0, length 0
19:55:24.023928 IP lucas-HP-Pavilion.43490 > debian-target.27715: Flags [S], seq 2771577488, win 64240, options [mss 1460,sackOK,TS val 1913351708 ecr 0,nop,wscale 7], length 0
19:55:24.023933 IP debian-target.27715 > lucas-HP-Pavilion.43490: Flags [R.], seq 0, ack 2771577489, win 0, length 0
19:55:24.023940 IP lucas-HP-Pavilion.36352 > debian-target.gsigatekeeper: Flags [S], seq 4068305053, win 64240, options [mss 1460,sackOK,TS val 1913351708 ecr 0,nop,wscale 7], length 0
19:55:24.023948 IP debian-target.gsigatekeeper > lucas-HP-Pavilion.36352: Flags [R.], seq 0, ack 4068305054, win 0, length 0
19:55:24.023952 IP lucas-HP-Pavilion.37820 > debian-target.6156: Flags [S], seq 478968723, win 64240, options [mss 1460,sackOK,TS val 1913351708 ecr 0,nop,wscale 7], length 0
19:55:24.023958 IP debian-target.6156 > lucas-HP-Pavilion.37820: Flags [R.], seq 0, ack 478968724, win 0, length 0
19:55:24.023965 IP lucas-HP-Pavilion.46114 > debian-target.1041: Flags [S], seq 166608547, win 64240, options [mss 1460,sackOK,TS val 1913351708 ecr 0,nop,wscale 7], length 0
19:55:24.023973 IP debian-target.1041 > lucas-HP-Pavilion.46114: Flags [R.], seq 0, ack 166608548, win 0, length 0
19:55:24.023979 IP lucas-HP-Pavilion.55652 > debian-target.4125: Flags [S], seq 4042098571, win 64240, options [mss 1460,sackOK,TS val 1913351708 ecr 0,nop,wscale 7], length 0
19:55:24.023984 IP debian-target.4125 > lucas-HP-Pavilion.55652: Flags [R.], seq 0, ack 4042098572, win 0, length 0
19:55:24.023992 IP lucas-HP-Pavilion.58246 > debian-target.48080: Flags [S], seq 1042442659, win 64240, options [mss 1460,sackOK,TS val 1913351708 ecr 0,nop,wscale 7], length 0
19:55:24.023997 IP debian-target.48080 > lucas-HP-Pavilion.58246: Flags [R.], seq 0, ack 1042442660, win 0, length 0
19:55:24.024004 IP lucas-HP-Pavilion.36964 > debian-target.3269: Flags [S], seq 3974056836, win 64240, options [mss 1460,sackOK,TS val 1913351708 ecr 0,nop,wscale 7], length 0
19:55:24.024010 IP debian-target.3269 > lucas-HP-Pavilion.36964: Flags [R.], seq 0, ack 3974056837, win 0, length 0
19:55:24.024017 IP lucas-HP-Pavilion.43154 > debian-target.801: Flags [S], seq 4215799559, win 64240, options [mss 1460,sackOK,TS val 1913351708 ecr 0,nop,wscale 7], length 0
19:55:24.024022 IP debian-target.801 > lucas-HP-Pavilion.43154: Flags [R.], seq 0, ack 4215799560, win 0, length 0
19:55:24.024030 IP lucas-HP-Pavilion.52836 > debian-target.1718: Flags [S], seq 3397637422, win 64240, options [mss 1460,sackOK,TS val 1913351708 ecr 0,nop,wscale 7], length 0
19:55:24.024035 IP debian-target.1718 > lucas-HP-Pavilion.52836: Flags [R.], seq 0, ack 3397637423, win 0, length 0
19:55:24.024042 IP lucas-HP-Pavilion.53092 > debian-target.7778: Flags [S], seq 3268789540, win 64240, options [mss 1460,sackOK,TS val 1913351708 ecr 0,nop,wscale 7], length 0
19:55:24.024047 IP debian-target.7778 > lucas-HP-Pavilion.53092: Flags [R.], seq 0, ack 3268789541, win 0, length 0
19:55:24.024053 IP lucas-HP-Pavilion.60892 > debian-target.1114: Flags [S], seq 3110366715, win 64240, options [mss 1460,sackOK,TS val 1913351708 ecr 0,nop,wscale 7], length 0
19:55:24.024061 IP debian-target.1114 > lucas-HP-Pavilion.60892: Flags [R.], seq 0, ack 3110366716, win 0, length 0
19:55:24.024076 IP lucas-HP-Pavilion.42684 > debian-target.34571: Flags [S], seq 3367883170, win 64240, options [mss 1460,sackOK,TS val 1913351708 ecr 0,nop,wscale 7], length 0
19:55:24.024082 IP debian-target.34571 > lucas-HP-Pavilion.42684: Flags [R.], seq 0, ack 3367883171, win 0, length 0
